Title,Price,Availability
It's Only the Himalayas,£45.17,In stock
Full Moon over Noah’s Ark: An Odyssey to Mount Ararat and Beyond,£49.43,In stock
See America: A Celebration of Our National Parks & Treasured Sites,£48.87,In stock
Vagabonding: An Uncommon Guide to the Art of Long-Term World Travel,£36.94,In stock
Under the Tuscan Sun,£37.33,In stock
A Summer In Europe,£44.34,In stock
The Great Railway Bazaar,£30.54,In stock
A Year in Provence (Provence #1),£56.88,In stock
The Road to Little Dribbling: Adventures of an American in Britain (Notes From a Small Island #2),£23.21,In stock
Neither Here nor There: Travels in Europe,£38.95,In stock
"1,000 Places to See Before You Die",£26.08,In stock
